,Article ID,Article Title,Coin Mentioned,Positive,Neutral,Negative
728,1154.0,Crypto College? US University Launches Experiential Education Programs in Blockchain and Digital Assets,"uni,xcn",,x,
729,1156.0,Cardano (ADA) Founder Charles Hoskinson Says Bear Market Makes Crypto Industry Collaboration Easier – Here’s Why,ada,,x,
730,1157.0,"One Ethereum (ETH) Rival Will Outperform Vast Majority of Altcoin Market, According to Top Crypto Trader",eth,,x,
731,1158.0,"Crypto’s Richest Billionaire Says Bitcoin (BTC) Will Revisit $69,000 Price – Here’s His Timeline",btc,x,,
732,1159.0,"Crypto Whales Are Massively Accumulating One Ethereum Scaling Altcoin, According to Analytics Firm Santiment",eth,,x,
733,1160.0,What Should Web 3.0 Builders Focus on To Emerge Stronger From the Bear Market?,trx,,x,
734,1161.0,Legendary Investor Mark Mobius Says Bitcoin Bottom Is Not in Yet – Here’s Why,btc,,,x
735,1162.0,Billionaire Michael Saylor Says Government Can Help Draw Investors to Bitcoin (BTC) – Here’s How,btc,,x,
736,1163.0,"Ethereum Whale Accumulates 163,200,000,000 Shiba Inu (SHIB) As Memecoin Witnesses Trading Volume Spike: On-Chain Analysis","eth,shib",x,,
737,1164.0,"Here’s What’s Next for Ethereum, Fantom and One Additional Altcoin, According to Analyst Michaël van de Poppe","eth,ftm",,x,
738,1165.0,Tether To Work With UK Regulators for Launch of New Stablecoin Pegged to British Pound,usdt,x,,
739,1166.0,"Coinbase Launches Altcoin Listing Spree, Adding Long List of Crypto Assets Built on Ethereum",eth,,x,
740,1167.0,Analyst Who Predicted Bitcoin Crash Far in Advance Forecasts Imminent Crypto Market Shift,btc,,x,
741,1168.0,"Former Executive From Crypto Exchange Huobi Accused of Netting $5,000,000 via Illicit Trading: Report",ht,,,x
742,1170.0,Korea Blockchain Week To Hold First Live Event in Seoul After Covid Hiatus,xcn,,x,
743,1171.0,Cardano Creator Charles Hoskinson Says Terra (LUNA) Collapse Contributed To Delay in Major ADA Upgrade,ada,,,x
744,1172.0,"Elon Musk Reveals Why He Supports Dogecoin (DOGE), Says He Never Advised Investing in Crypto",doge,,x,
745,1173.0,"Whales Have Quietly Triggered a 900% Surge for Embattled Crypto Asset, According to Analytics Firm Santiment",bat,,x,
746,1174.0,On-Chain Indicator Suggests Bitcoin (BTC) Bottom Is Near With Fresh Accumulation Phase Underway: Analyst Benjamin Cowen,"btc,near",x,,
747,1175.0,May 2022 – Monthly Research Key Data – ETH Gas Price Rose by 20%,"eth,rose",,,x
748,1176.0,"Crypto Capitalist Arthur Hayes Issues Fresh Warning, Says Forced Selling Still a Threat to Bitcoin and Ethereum","btc,eth",,x,
749,1178.0,Bot Known for Outperforming Crypto Markets Unveils Altcoin Selections Amid Wild Bitcoin and Ethereum Price Action,"btc,eth",,x,
750,1179.0,Trader Who Called Current Market Collapse Makes Bitcoin (BTC) Bottom Prediction – Here’s His Price Target,btc,,x,
751,1180.0,Stablecoin Tether (USDT) To Undergo Full Audit From Top Firm in Bid for Transparency,usdt,x,,
752,1181.0,"Here’s What’s Ahead for Solana, Avalanche and One Low-Cap Altcoin, According to Top Crypto Analyst","avax,sol",,x,
753,1182.0,Coinbase Triggers 107% Altcoin Explosion After Listing Slew of Ethereum-Based Crypto Assets,"eth,ltc",,x,
754,1185.0,FTX US Chief Brett Harrison Names Three Things That Could Spark Crypto Market Recovery,ftt,,x,
755,1186.0,"Here’s the Worst-Case Scenario for Bitcoin (BTC), According to Crypto Analyst Nicholas Merten",btc,,x,
756,1187.0,"Top Crypto Strategist Details Bullish Scenario for Bitcoin As BTC Surges Above $21,000",btc,,x,
757,1188.0,Trader Who Called 2018 Bear Market Bottom Says One Altcoin Already Gearing Up for Next Bull Market,ltc,,x,
758,1190.0,"Top Crypto Analyst Warns of Further Downside for Ethereum, Polkadot and Chainlink – Here Are His Targets","dot,eth,link",,x,
759,1191.0,"Crypto Exchange FTX Injects $250,000,000 Into BlockFi, Acquires Stock-Clearing Startup",ftt,x,,
760,1192.0,"Institutional Investors Are Ditching Ethereum in Favor of One of Its Biggest Rivals, According to CoinShares",eth,x,,
761,1193.0,Bloomberg Analyst Says Bitcoin and Gold Could Benefit From Potential Incoming Deflationary Phase,btc,,x,
762,1194.0,Solana-Based Lending Platform Votes To Seize Whale’s Funds To Prevent Instability,sol,,,x
763,1195.0,"Here’s Why a Bitcoin Dip Below $20,000 This Week Would Be Vastly Different From Last Week’s Move: Economist Alex Krüger",btc,,x,
764,1196.0,"Analyst Says Cardano Appears Ready to Break Out, Updates Outlook on Chainlink and Verasity","ada,link",x,,
765,1197.0,Gate.io – The Crypto Winter Is a Good Time To Accelerate Web 3.0,"cel,gt",x,,
766,1198.0,"Bitcoin Investors Lock in Over $7,325,000,000 in Losses Amid Three Days of Deep Capitulation: Glassnode",btc,,x,
767,1200.0,Analyst Says Bitcoin May Be Following Cycles of the Past With New Bull Market To Come – Here’s How,btc,x,,
768,1201.0,"Cardano Founder Charles Hoskinson Comments on XRP Lawsuit, Calls It ‘Regulation Through Enforcement’","ada,xrp",,x,
769,1202.0,"Biggest Ethereum Whales Flock to Apecoin, PAX Gold, Stablecoins and Three More Altcoins: On-Chain Data","ape,eth,paxg",,x,
770,1203.0,Bitcoin Bottom Finally In? Trader Who Predicted May 2021 Crash Looks at the State of BTC,btc,,x,
771,1205.0,"Bitcoin (BTC) May Have Further To Fall Until One Catalyst Triggers Reversal, Says Crypto Analyst Benjamin Cowen",btc,,,x
772,1206.0,"Elon Musk Reiterates Support for Dogecoin After Facing $258,000,000,000 Crypto Lawsuit",doge,,x,
773,1207.0,"Here’s What’s Ahead for Binance Coin (BNB) in 2022, According to Coin Bureau",bnb,,x,
774,1208.0,Macro Guru Lyn Alden Says Only Bitcoin Can Solve Global Monetary Problems – Here’s Why,btc,x,,
775,1209.0,ADI Whitelist – A Universal Identity Layer by Accumulate,uni,,x,
776,1210.0,"Tether Faces Ransom Demand and Massive Denial of Service Attack, According to CTO Paolo Ardoino",usdt,,,x
777,1211.0,Crypto Firm Celsius Addresses Community As Top Investor Details Potential Recovery Plan,"cel,uni",,x,
778,1212.0,"Analyst Who Saw 2022 Bitcoin Crash Coming Updates BTC and Ethereum Forecast, Issues Fresh Alert for Crypto Traders","btc,eth",,x,
779,1213.0,"Analyst Says Solana (SOL), Polygon (MATIC) and One Additional Altcoin To Come Out Alive From Crypto Bear Market","matic,sol",,x,
780,1215.0,Pro-BTC Commissioner Hester Peirce Slams SEC for ‘Almost Legendary’ Resistance To Spot Bitcoin ETF,btc,,x,
781,1216.0,Veteran Trader Who Predicted Bitcoin (BTC) 2018 Collapse Unveils Massive Downside Target for Ethereum (ETH),"btc,eth",,x,
782,1217.0,Two Crypto Analysts Bullish on Ethereum Competitor That’s Showing ‘Incredible’ Strength,eth,,x,
783,1218.0,"Bitcoin (BTC) Will Whipsaw Traders to $100,000 This Year, Says Blockstream CEO Adam Back – Here’s How",btc,x,,
784,1219.0,"Analyst Michaël van de Poppe Unveils Altcoin Picks, Says He’s Bullish on Ethereum and Three ETH Rivals",eth,,x,
785,1220.0,"These Three Catalysts Could Spark a Bitcoin (BTC) Reversal, According to Top Crypto Analyst",btc,,x,
786,1222.0,FBI Agent Says Crypto Investment Scams on LinkedIn ‘Significant Threat’ to Consumers: Report,link,,,x
787,1223.0,"Here’s How Bitcoin (BTC) Could Generate a ‘True’ Bottom, According to Analyst Kevin Svenson",btc,,x,
788,1224.0,"Crypto Whales Suddenly Move Nearly $2,000,000,000 in Bitcoin As BTC Breaks $20,000 Level: On-Chain Data",btc,x,,
789,1226.0,"Top Bloomberg Analyst Says $20,000 Bitcoin May Be the New $5,000 – Here’s Why",btc,x,,
790,1227.0,"Billionaire CEO of $122,000,000,000 Asset Manager Predicts Bitcoin (BTC) Could Crash by Another 50%",btc,,,x
791,1231.0,BitMEX Co-Founder Arthur Hayes Warns of a Potential ‘Mega Crypto Dump’ Ahead – Here’s His Timeline,bit,,,x
792,1232.0,Glassnode Says One Crypto Asset Class Is Gaining Massive Popularity Amid Huge Ethereum (ETH) Unrealized Losses,eth,,x,
793,1233.0,Co-Founder of Major Crypto Lender Says Bitcoin (BTC) Will Explode by Over 350% – Here’s His Timeline,btc,x,,
794,1234.0,"Little-Known Altcoin Soars 197% in Just One Week, Far Outperforming Bitcoin, Ethereum and Crypto Markets","btc,eth",,x,
795,1235.0,Platypus Finance Pioneers Unbiased NFT Minting on Avalanche,avax,,x,
796,1237.0,Digital Assets Exchange Crypto.com Rolls Out Support for Two Low-Cap Ethereum-Based Altcoins,"eth,ltc",,x,
797,1238.0,"Top Trader Warns Bitcoin (BTC) Support Looks ‘Weak AF,’ Analyzes Total Crypto Market Cap",btc,,x,
798,1239.0,Billionaire Mark Cuban Says Game-Changing Crypto Projects Will Break Through Market Slump – But One Class of Altcoin Projects Will Disappear,ltc,,x,
799,1240.0,Popular Meme Crypto Asset Dogecoin Launches New Testnet in Push Towards DeFi Adoption,doge,x,,
800,1241.0,"Investor Sues Elon Musk, Tesla and SpaceX for $258,000,000,000 Over Alleged ‘Dogecoin Pyramid Scheme’",doge,,,x
801,1242.0,"CNBC’s Jim Cramer Issues Massive Crypto Warning, Details Brutal Price Target for BTC",btc,,,x
802,1243.0,"Crypto Exchange Giant Coinbase Adds Three Ethereum (ETH) Altcoins Plus One DeFi Token, Spurring Surprise Rallies",eth,x,,
803,1244.0,State Regulators Across the US Are Probing Celsius Network (CEL) After Withdrawal Freeze This Week: Report,cel,,,x
804,1245.0,"Here’s What’s Next for Solana (SOL), Binance Coin (BNB) and Two Ethereum Rivals, According to Top Crypto Trader","bnb,eth,sol",,x,
805,1246.0,Billionaire Michael Saylor Addresses Margin Call Concerns on MicroStrategy’s Massive Bitcoin Position,btc,,x,
806,1247.0,"Crypto Trader Who Accurately Predicted Bitcoin Collapse to Sub-$23,000 Months Ago Warns of Potential New Lows",btc,,,x
807,1249.0,"Bitcoin (BTC) Approaching Level That Historically Acts As Cycle Bottom, Says Top Analyst",btc,x,,
808,1250.0,USD Coin (USDC) Issuer Circle Announces Launch of New Euro-Pegged Stablecoin,usdc,x,,
809,1251.0,Coinbase Adds Surprise Support for New Ethereum Altcoin Backed by Investment Giant Andreessen Horowitz,eth,,x,
810,1252.0,"Binance CEO Comments on Terra and Celsius Fallout, Says Bitcoin and Crypto Crash Is Part of Normal Market Cycle",btc,,x,
811,1253.0,Celsius Undergoing Restructuring Process With Attorneys To Address Potential Insolvency: Report,"cel,sol",,,x
812,1254.0,Tether (USDT) Issuer Says Rumors About Its Reserves Composition Are ‘Completely False’,usdt,,,x
813,1255.0,"Analyst Who Called 2022 Crypto Crash Updates Bitcoin and Ethereum Outlooks, Warns There Is Zero Reason To Flip Bullish","btc,eth",,x,
814,1257.0,Yield App Unveils Mobile App To Simplify Digital Wealth Management,mana,,x,
815,1258.0,Ankr Gives BNB Chain a Major Performance Upgrade With Its Open-Source Contributions,"bnb,xcn",x,,
816,1259.0,Shiba Inu (SHIB) Becomes Top Altcoin Among Ethereum Whales As Crypto Markets Crash: WhaleStats,"eth,shib",,x,
817,1260.0,"Metaverse Will Be a $5,000,000,000,000 Opportunity – But One Crypto Sector Will Remain Volatile: Consulting Giant",uni,x,,
818,1261.0,Crypto Billionaire Mike Novogratz Says Bitcoin Will Lead Market Recovery When One Policy Is Reversed,btc,,x,
819,1262.0,"Biggest Bitcoin Whale in Existence in Accumulation Mode, Stockpiles $20,900,000 in BTC",btc,x,,
820,1263.0,Hedge Fund Billionaire Anthony Scaramucci Says His Firm Bought the Carnage on Bitcoin (BTC) and Ethereum (ETH),"btc,eth",x,,
821,1264.0,"Here’s How Low Ethereum, Solana, Avalanche and One Additional ETH Rival Will Go, According to Crypto Analyst","avax,eth,sol",,,x
822,1265.0,"Price and Value of Bitcoin Completely Decoupling, Says Morgan Creek’s Anthony Pompliano",btc,,,x
823,1268.0,"After Celsius’ Troubles, SEC Boss Gary Gensler Issues Warning on Dangers of Unregulated Crypto Industry",cel,,,x
824,1269.0,Top Fidelity Macro Analyst Says Bitcoin (BTC) Way Oversold as Key On-Chain Metric Reaches 2011 Levels,btc,,x,
825,1271.0,Ankr Becomes an RPC Provider to Ethereum Layer Two Scaling Solution Optimism,"eth,op",,x,
826,1272.0,Crypto Trader Who Accurately Called Two Separate Bitcoin Collapses Looks at State of BTC,btc,,x,
827,1273.0,Ex-BitMEX CEO Arthur Hayes Warns Bitcoin and Ethereum on Brink of Epic Collapse,"btc,eth",,x,
828,1274.0,"Shark Tank Investor Kevin O’Leary Details Crypto Holdings, Name-Drops Bitcoin, Ethereum, Solana and Additional Altcoins","btc,eth,sol",,x,
829,1275.0,Crypto Trader Who Nailed 2018 Bear Market Bottom Says Bitcoin and Ethereum Very Close To Pivotal Moment,"btc,eth",,x,
830,1277.0,Billionaire Stanley Druckenmiller Says Bitcoin Beats Gold in a Bull Market Inflationary Environment – Here’s Why,btc,x,,
831,1278.0,"Coinbase CEO Brian Armstrong Announces Massive Staff Cuts, Citing Recession and Crypto Winter",trx,,,x
832,1279.0,"Here Are the Potential Bear Market Bottom Targets for Bitcoin (BTC), According to Top Crypto Strategist",btc,,,x
833,1280.0,Macro Investor Raoul Pal Says He’s Doubling Down on Crypto Position in Face of Market Collapse,cro,x,,
834,1281.0,Responsible Bitcoin Miner CCU Honors Satoshi Nakamoto Changes Name to SATO Technologies To Coincide With Existing Ticker TSX.V:SATO,btc,,x,
835,1283.0,Solana (SOL) Dominating Institutional Capital Flows for 2022 As Crypto Carnage Continues: CoinShares,sol,,x,
836,1284.0,Coinbase Triggers Explosive Rally for Ethereum-Based Altcoin As Exchange Announces Support for New Crypto Assets,"eth,ltc",,x,
837,1286.0,Spritz Finance Bill Pay Beta Launches on Polygon Network,matic,,x,
838,1287.0,Dogecoin (DOGE) Co-Creator Calls Crypto Industry a Facilitator of Scams That Exists Outside of Government Control,doge,,,x
839,1288.0,"Tron Founder Justin Sun Announces Plan To Deploy $2,000,000,000 To Defend USDD Peg As Crypto Markets Plummet","trx,usdd",,x,
840,1289.0,"Over $1,300,000,000 in Crypto Liquidated in Last 24 Hours As Bitcoin Threatens To Breach $20,000",btc,,,x
841,1290.0,Trader Who Nailed Epic Bitcoin 2018 Collapse Says Extreme BTC Correction Looming – Here’s His Target,btc,,x,
842,1291.0,Solana (SOL) vs. Near Protocol (NEAR) – Coin Bureau Host Analyzes Top Ethereum Rivals,"eth,near,sol",,x,
843,1293.0,FTX US Chief Brett Harrison Says Crypto Markets’ Correlation With Stocks Not What Traders Think – Here’s Why,ftt,,x,
844,1294.0,Binance Resumes Bitcoin Withdrawals After Pausing BTC Outflows Amid Wild Market Action,btc,,x,
845,1295.0,Ripple Executive Says Last Year and a Half Has Been Strongest Ever for Company Despite Lawsuit,"trx,xec",x,,
846,1296.0,CEL Token Collapses 99% From Highs As Celsius Network Halts All Withdrawals,cel,,,x
847,1297.0,Is This Capitulation? Veteran Trader Tone Vays Calls for Bitcoin (BTC) Bottom – Here’s When,btc,,x,
848,1299.0,"Trader Who Accurately Called Bitcoin Plunge Below $23,000 Updates Crypto Forecast",btc,,x,
849,1301.0,"Under-the-Radar Altcoin Could Ignite Multiple 200% Rallies in Coming Months, Says Analyst Michaël van de Poppe","ada,ltc,omi",,x,
850,1302.0,Ethereum Capitulation Imminent As ETH Follows 2018 Market Structure: Crypto Analyst Kevin Svenson,eth,,x,
851,1303.0,"Short but Very Sharp Recession Ahead, Warns Macro Guru Raoul Pal – Here’s His New Outlook for Crypto",cro,,x,
852,1305.0,Institutional Investors Buying Bitcoin Weakness As VC Firms Accelerate Interest in Crypto: Glassnode Co-Founders,btc,,x,
853,1306.0,"World’s Biggest Ethereum Whales Accumulate Aave, Compound and Four Additional Altcoins: On-Chain Data","aave,eth",x,,
854,1307.0,Majority of Crypto Hedge Funds Extremely Bullish on Bitcoin Despite Weak Price Action: PwC Study,btc,x,,
855,1309.0,Crypto Analyst Predicts Strong Cardano (ADA) Bounce Toward End of June – But There’s a Catch,ada,,x,
856,1310.0,"Over $521,000,000 in Crypto Liquidated in Just 24 Hours As Ethereum (ETH) Plummets to 14-Month Low",eth,,,x
857,1311.0,"Crypto Market Pullback Imminent, According to Top Analyst – Here’s His Downside Targets for Bitcoin and Altcoins",btc,,x,
858,1312.0,"Nearly 75% of US Merchants Plan To Accept Crypto or Stablecoins Within Two Years, According to Deloitte Survey",near,x,,
859,1313.0,"Bitcoin (BTC) Flying off Exchanges Amid Price Stagnancy, According to Crypto Analytics Firm IntoTheBlock",btc,,x,
860,1314.0,U.S. Treasury Secretary Janet Yellen Warns Against Investing in Bitcoin (BTC) for Retirement – Here’s Why,btc,,,x
861,1315.0,Is Bitcoin an Inflation Hedge? BTC and Crypto Market Dip Amid Reports of Rising Cost of Living in the US,btc,,x,
862,1316.0,Ripple Competitor and MoneyGram Roll Out Zero-Fee Money Transfer Service Using USDC Stablecoin,usdc,x,,
863,1317.0,Digital Assets Exchange Crypto.com Lists Three Little-Known Altcoins,ltc,,x,
864,1318.0,"Bitcoin (BTC) Will Explode by Over 700%, According to CEO of $80,000,000,000 Asset Manager: Report",btc,x,,
865,1319.0,"Crypto Market Downturns Have One Massive Positive Impact, Says Cardano (ADA) Creator Charles Hoskinson",ada,,x,
866,1320.0,Jack Dorsey and Jay-Z Launch New ‘Bitcoin Academy’ To Provide BTC Education to Brooklyn Public Housing Residents,btc,x,,
867,1321.0,"CNBC’s Jim Cramer Says He’s a Believer in Bitcoin and Ethereum, Warns Against Risky Investment Strategy","btc,eth",,x,
868,1323.0,Coinbase Executive Says Crypto More ‘Inevitable’ Than Ever Before As Global Adoption Accelerates,"cel,xec",x,,
869,1324.0,US Court Orders Embattled Terra (LUNA) Founder Do Kwon To Comply With SEC Subpoena,bat,,,x
870,1326.0,Shark Tank’s Kevin O’Leary Says One Sector of Crypto Markets Offers Biggest Opportunity for Global Transformation,uni,,x,
871,1327.0,"Coinbase Custody Adds Support for 16 Altcoins, Including 13 Ethereum-Based Tokens","eth,ltc",,x,
872,1328.0,On-Chain Analyst Willy Woo Says Bitcoin Is Showing Signs of Bottoming Out – But There’s a Catch,btc,,x,
873,1329.0,"Here’s What’s Next for Solana (SOL), Avalanche (AVAX), Chainlink (LINK) and ApeCoin (APE) According to Top Crypto Analyst","ape,avax,link,sol",,x,
874,1330.0,Coinbase CEO Brian Armstrong Says Bitcoin May Become New Global Reserve Currency,btc,x,,
875,1331.0,Top Crypto Whales Keep a Firm Grip on Ethereum (ETH) While Accumulating One Top-25 Altcoin: Analytics Firm,eth,,x,
876,1332.0,Privacy-Preserving ID Is Key to Crypto-Natives Accessing Value in TradFi,dfi,,x,
877,1333.0,"Altcoins Gearing Up To Potentially Double in Price As Bitcoin Relief Rally Ensues, Says Crypto Analyst",btc,x,,
878,1335.0,"History Suggests Bitcoin Bottom Still Not In, Says Top Crypto Analyst – Here’s His Target",btc,,,x
879,1336.0,"Here’s What Historically Happens to Bitcoin After Reaching Its ‘Death Cross,’ According to Top Crypto Analyst",btc,,x,
880,1337.0,Cardano Creator Charles Hoskinson Says Terra (LUNA) Collapse Has Triggered One Massive Change in ADA Development,ada,,,x
881,1338.0,"Top Crypto Exchange Coinbase Extends Altcoin Listing Spree, Supporting Two Ethereum-Based Altcoins","eth,ltc",,x,
882,1339.0,"Top Crypto Analyst Issues Bitcoin (BTC) Price Alert, Says Critical Phase Could Begin Today",btc,,x,
883,1340.0,"Tech Giant PayPal Beefs Up Support for Bitcoin (BTC), Ethereum (ETH) and Two More Crypto Assets","btc,eth",x,,
884,1342.0,"Real Capitulation Will Kick Off When Ethereum (ETH) Plunges Below This Critical Level, Warns Top Crypto Analyst",eth,,x,
885,1343.0,Cardano (ADA) Emerges As Favored Ethereum Rival in Grayscale Investments’ Smart Contract Platforms Fund,"ada,eth",,x,
886,1344.0,"Bitcoin (BTC) Is Eyeing a Significant Bounce, According to deVere Group CEO – Here’s His Timeline",btc,,x,
887,1345.0,"SEC Made a ‘Big Mistake’ That Will Come Back To Haunt Them in XRP Lawsuit, Says Legal Expert Jeremy Hogan",xrp,,x,
888,1347.0,"Bitcoin (BTC) Could Rally Significantly From Here, Says Analyst Benjamin Cowen – But There’s a Catch",btc,,x,
889,1349.0,FTX Chief Sam Bankman-Fried Says Firm Will Continue Hiring As Others Cut Jobs Amid Crypto Winter,ftt,x,,
890,1350.0,Chainlink (LINK) Bounces Nearly 25% After Release of New Long Term Roadmap,link,x,,
891,1351.0,Veteran Trader Peter Brandt Unveils Big Downside Target for Ethereum in New ETH Forecast Update,eth,,x,
892,1353.0,Little-Known Altcoin Built on Ethereum Explodes 407% As Coinbase Adds It to Listing Roadmap,eth,x,,
893,1354.0,"Bitcoin Short-Term Holders Approaching Peak Pain As BTC Trades Below $30,000: Analytics Firm Glassnode",btc,,,x
894,1355.0,"Here’s What It Will Take for Ethereum, Solana and Avalanche To Spark Long-Awaited Rallies, According to Top Crypto Analyst","avax,eth,sol",,x,
895,1357.0,"Ethereum (ETH) Next Stop at $2,200? Top Crypto Analyst Explains How ETH Kicks Off Next Rally",eth,,x,
896,1358.0,Trader Who Accurately Predicted 2022 Bitcoin and Crypto Meltdown Says BTC Capitulation Imminent After Recent Rally,btc,,x,
897,1359.0,"Don’t Count on Massive Bitcoin (BTC) Capitulation, Says Top Crypto Analyst – Here’s Why",btc,,x,
898,1361.0,"Altcoins in Danger of Getting Wrecked As Bitcoin Forms Bottom, According to Top Crypto Analyst",btc,,x,
899,1362.0,"Crypto Exchange Kraken Says Decentraland, The Sandbox and Metaverse Sector Far Outperforming Market Year-on-Year","mana,sand",x,,
900,1363.0,Tron (TRX) Founder Justin Sun Unveils Plan To Secure USDD Stablecoin From Terra-Like Collapse,"trx,usdd",,x,
901,1364.0,Binance Facing SEC Investigation of BNB Token As Crypto Giant Responds to Money Laundering Allegations,bnb,,,x
902,1365.0,Israel’s Most Prominent VC Pitango Launches First Labs Investment DAO To Bridge Web 2.0 and Web 3.0,omi,,x,
903,1366.0,"Coinbase Gives Surprise Support to Two Altcoins Built on Ethereum, Triggering Price Spike",eth,,x,
904,1368.0,Singapore’s Cake DeFi Pays Record $317 Million in Rewards to Customers,cake,x,,
905,1369.0,"Kingspeed Celebrates Its Brand New NFT ‘The Flash’ on Its Marketplace With 10% Discount Until June 30, 2022",cel,,x,
906,1370.0,Farsite Starts Recruiting Pilots for Interstellar Scholarship Program,xlm,,x,
907,1371.0,Shark Tank Investor Kevin O’Leary Says Wild Price Swings of Bitcoin (BTC) Could Disappear if This Happens,btc,,x,
908,1372.0,Ethereum Challenger Explodes Over 132% in Just One Week Amid Campaign To Support Its Algorithmic Stablecoin,eth,,x,
909,1373.0,"Solana, Dogecoin and This Type of Crypto Asset Are Top Altcoins To Accumulate in Bear Market Bottom, According to Popular Analyst","doge,sol",,x,
910,1374.0,Crypto Analyst Who Nailed Bitcoin May 2021 Collapse Predicts Incoming BTC Rally – Here’s His Target,btc,,x,
911,1375.0,Analyst Predicts Solana (SOL) and Additional Ethereum Rival Will Pull Off Unexpected Bear Market Rallies,"eth,sol",,x,
912,1376.0,Institutional Investors Flock to Safety of Bitcoin As Altcoins See Almost No Capital Flows: CoinShares,btc,,x,
913,1377.0,Fidelity Macro Analyst Makes Long Term Bitcoin Forecast Using New Trading Models,btc,,x,
914,1378.0,"Here’s What’s Next for Cardano, Terra, STEPN and Two Additional Altcoins, According to Top Crypto Analyst","ada,gmt",,x,
915,1379.0,"Scammers Compromise Bored Ape Yacht Club and Otherside Discord Servers, Steal 32 NFTs Worth $259,000: Report",ape,,,x
916,1380.0,Highly Anticipated Bill Aimed at Regulatory Clarity for Crypto To Hit Washington: Report,gt,,x,
917,1381.0,Binance Triggers Rally for Decentralized Finance Altcoin With Announcement of Strategic Investment,ltc,,x,
918,1382.0,Coinbase Cancels Job Offerings and Pauses Hiring Process Amid Crypto Bear Market,cel,,,x
919,1384.0,Host of Coin Bureau Says He’s Confident in Ethereum Rival Solana (SOL) Despite Recent Outages – Here’s Why,"eth,sol",,x,
920,1385.0,Macro Strategist Lyn Alden Says Bitcoin (BTC) Among Hard Assets To Own Amid Long-Term Inflationary Environment,btc,,x,
921,1386.0,Biggest Ethereum Whales Load Up on One Exchange Token and Three Decentralized Finance Altcoins: On-Chain Data,eth,,x,
922,1387.0,Crypto Strategist Predicts Price Paths for Bitcoin (BTC) and Ethereum Rival Solana for Rest of 2022,"btc,eth,sol",,x,
923,1388.0,Here’s How Bitcoin Could Perform in Coming Weeks As BTC Impersonates June 2021 Price Action: Top Analyst,btc,,x,
924,1389.0,ARK Invest’s Cathie Wood Says Big Upside Volatility Coming for Bitcoin As On-Chain Data Flashes Green for BTC,btc,,x,
925,1392.0,Trader Who Accurately Called Epic Bitcoin Crash Issues New Warning for Ethereum Investors,"btc,eth",,x,
926,1393.0,Coin Bureau Updates Outlook on Top Ethereum Rival Avalanche (AVAX),"avax,eth",,x,
927,1394.0,Crypto Capitalist Arthur Hayes Details Massive End-of-Year Forecast for Ethereum (ETH),eth,,x,
928,1395.0,"Bloomberg Analyst Predicts Huge Reversal in Gold, Bonds and Bitcoin as One Crypto ‘Revolutionizes’ Fintech",btc,,x,
929,1396.0,On-Chain Metrics Suggest This Crypto Bear Market Won’t Be As Brutal as Past Cycles: Analytics Firm IntoTheBlock,xcn,x,,
930,1397.0,US Lawmakers Introduce Bill To Require Members of Congress To Disclose Crypto Holdings,mkr,,x,
931,1398.0,"Dogecoin (DOGE) Co-Creator Says Web3 Has Zero Value, Warns NFTs Are a Way To Get New Suckers Into Crypto: Report",doge,,,x
932,1399.0,Eyes on New York Governor Kathy Hochul After State Lawmakers Pass Moratorium on Proof-of-Work Crypto Mining,mkr,,x,
933,1401.0,"Top Crypto Strategist Warns Ethereum Investors, Says ETH at Risk of Nosedive",eth,,,x
934,1402.0,"Bitcoin May Witness Massive Rally This Year, According to Macro Expert Lyn Alden – Here’s What Needs To Happen",btc,,x,
935,1403.0,"Ethereum-Based Altcoin Skyrockets 70% in Just 10 Days, Thwarting Crypto Market Trend","eth,ltc",,x,
936,1404.0,US Markets Regulator Sues Crypto Exchange Gemini Over Alleged Violations Regarding Bitcoin (BTC) Futures Product,btc,,,x
937,1405.0,Coinbase Executive Reassures Traders That User Funds Are Safe Despite Crypto Bear Market,xec,,x,
938,1406.0,Leading Ethereum (ETH) Competitor’s Price Falls by Double Digits After Network Crashes,eth,,,x
939,1407.0,"Crypto Analyst Michaël van de Poppe Says Bitcoin, Ethereum and One ETH Competitor Are Close to Bouncing","btc,eth",,x,
940,1408.0,Retirement Plan Advisor Sues U.S. Department of Labor Over ‘Arbitrary’ Crypto Guidance,bit,,,x
941,1410.0,Top Crypto Analyst Pinpoints Date on Bitcoin and Crypto Turnaround,btc,,x,
