,Article ID,Article Title,Coin Mentioned,Positive,Neutral,Negative
1365,1934.0,"Top Crypto Analyst Issues Warnings for Bitcoin, Chainlink and The Sandbox – Here Are His Targets","btc,link,sand",,X,
1366,1936.0,"Low-Cap Ethereum Competitor Surges 68% In One Week, Outpacing Vast Majority of Crypto Projects",eth,,X,
1367,1937.0,"Crypto Analyst Warns He’s an Ethereum (ETH) ‘Bear Now, Bull Later,’ Examines a Stalling Bitcoin (BTC)","btc,eth",,X,
1368,1938.0,"Terra (LUNA) Network Addresses Scammed Out of $4,310,000 in Phishing Attack: Blockchain Security Firm SlowMist",xcn,,,X
1369,1940.0,"Billionaire Mark Cuban Reveals Massive Ethereum Position, Says Bitcoin Maximalists Are Wrong About True Upside in Crypto Markets","btc,eth",,X,
1370,1943.0,"This Altcoin Is the Biggest Threat to Ethereum (ETH) So Far This Year, According to CryptoCompare",eth,,X,
1371,1944.0,"99% of Crypto Assets Are Securities, Warns Bitcoin (BTC) Firebrand Michael Saylor",btc,,X,
1372,1945.0,"One Ethereum Competitor Is Primed for an Explosive Rally, According to Coin Bureau",eth,,X,
1373,1946.0,"Bitcoin Whale Abruptly Moves Over $600,000,000 in BTC – Here’s Where the Massive Crypto Trove Is Going",btc,,X,
1374,1948.0,"Here’s How Bitcoin (BTC) Can Explode by 25x From Current Price, According to Crypto Analyst Jason Pizzino",btc,,X,
1375,1949.0,FTX CEO Sam Bankman-Fried Outlines Ways To Fix Social Media Amid Elon Musk’s Twitter Takeover Plans,ftt,,X,
1376,1950.0,Ethereum Whales Are Accumulating Bitcoin and Two Altcoin Projects While Unloading Dogecoin Rival Shiba Inu: On-Chain Data,"btc,doge,eth,shib",,X,
1377,1951.0,"Widely-Followed Crypto Trader Says Bitcoin (BTC) Could Retest $46,000 Soon, Explains STEPN (GMT) Valuation","btc,gmt",X,,
1378,1952.0,Privacy Coin Monero (XMR) Outperforms Most of the Crypto Market Ahead of Upgrade,xmr,,X,
1379,1953.0,TRON (TRX) Founder Justin Sun Announces Launch of New Stablecoin Backed by Crypto Assets,trx,,X,
1380,1954.0,Ethereum-Based Altcoin Project Explodes 61% After Revealing Coinbase Partnership,"eth,ltc",,X,
1381,1955.0,"Crypto Analyst Says Altcoins In for a ‘Strong Leg Up,’ Predicts Bitcoin (BTC) Will Surge by Over 30%",btc,,X,
1382,1956.0,Is Cardano About To Break Out? Analytics Firm Says Traders Feel Confident About ADA,ada,,X,
1383,1957.0,46 Crypto Executives Push EU Regulators To Reconsider Upcoming Digital Asset Rule Changes: Report,"omi,xec",,X,
1384,1958.0,Top Trader Warns Extended Bitcoin Bear Market Coming Before Reversal – Here’s His Timeline,btc,,,X
1385,1959.0,"Analyst Predicts Big Move for Ethereum Rival Terra (LUNA), Highlights ‘Very Bullish’ Metric for Bitcoin","btc,eth",,X,
1386,1960.0,"Bottom Is In and Reversal Underway for Bitcoin (BTC), According to Top Crypto Analyst",btc,,X,
1387,1962.0,"Bitcoin (BTC) Sitting at Crossroads of 2018-Style Bear Market and Continued Bull Run, Says Crypto Analyst",btc,,X,
1388,1963.0,"Shark Tank’s Kevin O’Leary Unveils Large Crypto Portfolio, Says He’s Accumulating Solana, Polygon and Three Additional Altcoins","matic,sol",,X,
1389,1964.0,Ripple CEO Brad Garlinghouse Says Bitcoin Maximalism Hurting Crypto Industry’s Lobbying Efforts: Report,btc,,X,
1390,1965.0,Ethereum-Based Altcoin Soars 55% As Metaverse Airdrop Rumors Spread,"eth,ltc",X,,
1391,1967.0,"Tezos, Bloomberg Philanthropies and Serpentine To Present an Interactive NFT Installation, ‘Un Pezzo D’Arte,’ at Venice Biennale for Three Days Only",xtz,,X,
1392,1968.0,H2O Data Secures Strategic Round for Its Data-Backed Stable Asset Ahead of TGE and Targeted Community Airdrop,uni,,X,
1393,1969.0,Republican Lawmakers Pen Open Letter to SEC Criticizing Two New Proposals,mkr,,X,
1394,1970.0,Analyst Says Record High Imminent for One Ethereum Challenger,eth,,X,
1395,1971.0,Quant Analyst Plan B Says Bitcoin Currently Presenting Best Opportunity for Bulls in Entire History of BTC,"btc,qnt",X,,
1396,1972.0,"Crypto Analyst Unveils Massive Target for Ethereum Rival Solana, Predicts Rallies for Avalanche and Terra","avax,eth,sol",,X,
1397,1973.0,A New Era of Mass Adoption – Shopify To Bring Bitcoin to a Quarter of Global Population,btc,X,,
1398,1974.0,"Ethereum (ETH) Rival Solana (SOL) and One Low-Cap Altcoin Flashing Bottom Signals, According to Crypto Analyst","eth,sol",,X,
1399,1975.0,"Bitcoin (BTC) on the Edge of Entering Another Multi-Month Dip, According to Crypto Analyst",btc,,X,
1400,1976.0,Rainmaker Games Launches The First Blockchain Gaming Discovery Platform,"mkr,xcn",,X,
1401,1977.0,"Mysterious Bitcoin Whale Accumulates Over $117,000,000 in BTC in Just One Week",btc,X,,
1402,1979.0,Crypto Analyst Who Nailed 2018 Bitcoin Bottom Predicts Swift Bounce for BTC – But There’s a Catch,btc,,X,
1403,1980.0,Institutional Investors Turn Cautious As Crypto Markets See Second Straight Week of Capital Outflows: CoinShares,"flow,ht",,,X
1404,1981.0,"Ethereum-Based Payments Altcoin Explodes 126% in Matter of Days As Bitcoin Breaks Above $41,000",btc,,X,
1405,1982.0,"Bitcoin (BTC) Net Outflows Hit $500,000,000 Last Week Amid Eager Investor Accumulation: IntoTheBlock",btc,,,X
1406,1984.0,XRP Gaining Ground to the Bullish Side As Ethereum (ETH) and Solana (SOL) Print Reasonable Lows: Crypto Analyst,"eth,sol,xrp",,X,
1407,1986.0,"Top Analyst Says One Group of Altcoins Can Pull Off 10x Rallies, Updates Outlook on Three Crypto Assets",ltc,,X,
1408,1987.0,Billionaire Chamath Palihapitiya Says Solana (SOL) Part of Massive Disruption of Global Payments Industry,sol,,X,
1409,1988.0,Quantitative Analyst PlanB Says Two Catalysts Could Trigger Next Bitcoin (BTC) Rally,btc,,X,
1410,1989.0,Three Indicators With Historic Track Record for Calling Bitcoin (BTC) Rallies Flash Bullish: Crypto Analyst,btc,,X,
1411,1990.0,"Solana (SOL) Faces Stiff Competition From Another Hot Ethereum Competitor, Says Coin Bureau","eth,sol",,X,
1412,1991.0,"Bulls Still in Control Despite Bitcoin Dip Below $40,000, Says Crypto Analyst Nicholas Merten – Here’s Why",btc,,X,
1413,1992.0,"Algorithm Known for Outperforming Crypto Markets Favors Ethereum (ETH), Terra (LUNA), Solana (SOL) and One Additional Altcoin","eth,sol",,X,
1414,1993.0,Current Economic Conditions Make Top Analyst ‘Amazingly Bullish’ on Crypto and Tech Stocks – Here’s Why,omi,,X,
1415,1994.0,Under-the-Radar Altcoin Defies Crypto Market Correction With 43% Price Spike in Less Than a Day,"ada,ltc",,X,
1416,1995.0,"Ethereum Has Squashed One of the Key Arguments for Holding Bitcoin, According to Macro Guru Raoul Pal","btc,eth",,X,
1417,1997.0,"Ethereum-Based Coin Mixer Tornado Cash Blocks Sanctioned ETH Addresses, Founder Says There Are Limits to Privacy",eth,,X,
1418,1998.0,"Top Analyst Says Big Run Coming for XRP and Litecoin, Predicts One Metric Will Trigger Next Crypto Bull Cycle","ltc,xrp",,X,
1419,1999.0,"Fifth-Largest Ethereum Whale Initiates Massive 223,761,580,609 Shiba Inu Transfer As Dogecoin Rival Becomes Most-Accumulated Altcoin","doge,eth,shib",,X,
1420,2000.0,Billionaire Mark Cuban Is Making Big Changes to His Crypto Portfolio – Here’s a Look at His Ethereum Wallet,eth,,X,
1421,2001.0,FTX US Chief Brett Harrison Says New Trading Features Are Critical for the Advancement of Crypto Markets,ftt,,X,
1422,2002.0,"Bitcoin (BTC) in the Eye of the Storm, According to Glassnode Co-Founders – Here’s Why",btc,,X,
1423,2003.0,‘Surprising’ Development in XRP Lawsuit As SEC Decides To End Discovery Phase With Ripple: Crypto Legal Expert,xrp,,X,
1424,2004.0,Crypto Giant Coinbase Making Interactive Trilogy Film That Features NFT Collection Bored Ape Yacht Club,ape,,X,
1425,2005.0,"Litecoin (LTC) Whales Transact at Highest Level Since Early 2021, Says Crypto Anaytics Firm Santiment",ltc,X,,
1426,2006.0,"Bitcoin (BTC) Approaching a Crossroads As Ominous Price Pattern Forms, Says Crypto Analyst Benjamin Cowen",btc,,X,
1427,2007.0,"Bitcoin Under Heavy Accumulation Phase As Whales Now Hold Over $280,000,000,000 in BTC: Top On-Chain Analyst",btc,,X,
1428,2008.0,"Crypto Analyst Predicts Steep Correction for Ethereum Rival Terra, Updates Forecasts for ETH and Avalanche","avax,eth",,X,
1429,2010.0,Former Ripple Advisor Nominated To Serve As Vice Chair of U.S. Federal Reserve,"mina,omi",,X,
1430,2011.0,"$1,200,000,000 in Bitcoin Moved Out of Coinbase in Massive Daily Outflow, According to CryptoQuant CEO – Here’s Who Is Accumulating BTC",btc,X,,
1431,2014.0,"Bitcoin Whale Transactions Spike As $1,046,164,730 in BTC Leaves Crypto Exchanges in Just 24 Hours",btc,X,,
1432,2015.0,Little-Known Ethereum Rival Surges 49% in One Week As Bitcoin and Crypto Markets Correct,"btc,eth",,X,
1433,2016.0,"Ethereum Whales Pounce on Crypto Project Backed by FTX As Chainlink, Shiba Inu and Several Altcoins Endure Outflows","eth,ftt,link,shib",,X,
1434,2017.0,Quantum-Resistant Cardano? Creator Charles Hoskinson Lays Out Crypto Agenda for the Next Five Years,"ada,qnt",,X,
1435,2019.0,Avalanche (AVAX) Could Surpass Ethereum (ETH) Next Quarter in Terms of This Metric: Analytics Firm Messari,"avax,eth",,X,
1436,2020.0,Elon Musk Tweets About Dogecoin Becoming ‘Currency of the Internet’ With DOGE Co-Creator and Robinhood CEO,doge,,X,
1437,2022.0,Binance CEO Changpeng Zhao Says Crypto Adoption Will Ramp Up in 2022 – Here’s Why,amp,,X,
1438,2023.0,"North Korean Hackers Behind $600,000,000 Attack on Axie Infinity (AXS), According to U.S. Treasury",axs,,,X
1439,2024.0,"Here’s What Endangers Bitcoin (BTC) and Crypto Assets the Most, According to US Senator Ted Cruz",btc,,X,
1440,2025.0,Crypto Insights Outlet Blockworks Identifies Top Crypto Sectors for Investors Over the Next Two Years,ht,,X,
1441,2026.0,Meta Plans To Take Nearly 50% Cut of Every NFT Transaction in Horizon Worlds’ Metaverse: Report,near,,,X
1442,2028.0,AlgoBlocks Raises Total $2.3 Million To Bring Seamless Beginner-Friendly DeFi to More Crypto Users,algo,X,,
1443,2029.0,Dogecoin for Tipping Tweeters? FTX Founder Sam Bankman-Fried Outlines Vision for Remaking Twitter on Solana,"doge,ftt,sol",X,,
1444,2030.0,Macro Analyst Lyn Alden Says Near-Term Outlook for Bitcoin (BTC) Very Uncertain – Here’s Why,btc,,X,
1445,2031.0,"$10,000,000,000,000 Asset Manager Exploring Use of Top Five Crypto Asset in Traditional Capital Markets",mana,,X,
1446,2032.0,"Crypto Analyst Examines Cardano (ADA), Cosmos (ATOM) and Three Other Altcoins, Reveals What To Watch Out For","ada,atom",,X,
1447,2033.0,"Bitcoin Network Is Growing, Albeit Political and Economic Uncertainty",btc,,X,
1448,2034.0,"Backing Stablecoins With Bitcoin or Altcoins Eliminates This Massive Risk, Says Terra (LUNA) Founder Do Kwon",btc,,X,
1449,2035.0,"Elon Musk Offers $43,000,000,000 To Buy Twitter, Igniting Short-Lived Dogecoin (DOGE) Rally",doge,,X,
1450,2036.0,"Bitcoin (BTC) on Final Support Before Price Nosedives, Says Crypto Analyst Michaël van de Poppe",btc,,X,
1451,2037.0,Digital Assets Exchange Crypto.com Lists Three Little-Known Altcoins As Markets Trade Sideways,ltc,,X,
1452,2039.0,"Terra (LUNA) Purchases $100,000,000 in Bitcoin (BTC) As TerraUSD Launches on Crypto Exchange Binance",btc,X,,
1453,2040.0,Amazon CEO Says One Sector of Crypto Economy Will Grow Significantly – Is the Retail Giant Preparing To Accept Bitcoin?,"bit,btc",,X,
1454,2042.0,Ripple vs SEC: Judge Strikes Down Regulator’s Request To Withhold Key Documents in XRP Lawsuit,xrp,,X,
1455,2045.0,SolidProof Will Soon Make Its Auto Audit Tool Available for Users and Project Owners,sol,X,,
1456,2046.0,"Bitcoin (BTC) Will Hit $100,000 in 2022 After Blowing Past These Key Resistance Zones: Celsius Network CEO","btc,cel",,X,
1457,2047.0,Crypto Market Turnaround Coming? Analytics Firm Says Spike in This Metric Triggers Trend Reversal,omi,,X,
1458,2048.0,"Rich Dad Poor Dad Author Says One Ethereum Competitor Is Just Getting Started, Predicts Inflation Will Wipe Out US Economy",eth,,X,
1459,2049.0,"Pantera Capital Warns Investors Will Flee Stocks, Bonds and Real Estate This Year, Predicts Massive Crypto Rally Incoming",omi,X,,
1460,2051.0,"Massive Capitulation in Sight for Gaming Altcoin Axie Infinity (AXS), According to Crypto Strategist",axs,,X,
1461,2052.0,"Analyst Who Called May 2021 Crypto Collapse Says Case for $135,000 Bitcoin in Play",btc,,X,
1462,2053.0,Altcoins Close to Being ‘Obliterated’ As Bitcoin Holds On to Historically Critical Support Level: Crypto Analyst,btc,,X,
1463,2055.0,Is Bitcoin Following an Early 90s Stock Market Pattern? Crypto Analysts Make Bullish Case for BTC,btc,,X,
1464,2056.0,Cardano (ADA) Ecosystem Exploding As Hundreds of New Projects Spring Up: IOHK,ada,X,,
1465,2057.0,"Macro Guru Raoul Pal Says ‘The Low Is In’ for Crypto Markets, Upside Catalysts To Spark New Rallies",cro,,X,
1466,2058.0,"Here Are Two Bullish Scenarios for Bitcoin After Failed BTC Breakout, According to Top Crypto Analyst",btc,,X,
1467,2059.0,GateGrants Releases Q1 Sponsorship Roundup,gt,,X,
1468,2060.0,"Coinbase, FTX and Biggest Crypto Exchanges Consolidate Power As Traders Prefer Lower Risk Platforms: Report",ftt,,X,
1469,2061.0,Will the US Dollar Decide Bitcoin’s Next Move? Analyst Benjamin Cowen Looks at BTC’s Connection to USD,"bit,btc,enj",,X,
1470,2062.0,Crypto Giant Coinbase Reveals List of 50 Altcoins Under Consideration for Listing,ltc,,X,
1471,2063.0,"Crypto Strategist Says All-Time High Coming for One Ethereum Rival, Predicts Pullback for Two Other Altcoins",eth,,X,
1472,2064.0,"Massive Wall of Money Is Waiting To Enter Bitcoin and Crypto Markets, According to Shark Tank Investor Kevin O’Leary",btc,X,,
1473,2065.0,"Accumulation Phase of a Lifetime Could Be Coming for Bitcoin, Says Analyst Benjamin Cowen – Here’s Why",btc,,X,
1474,2066.0,"Don’t Count on Bitcoin (BTC) Collapse to $30,000, Says Crypto Analyst Nicholas Merten – Here’s Why",btc,,,X
1475,2067.0,Robinhood Sparks Crypto Rallies After Listing Dogecoin Rival Shiba Inu (SHIB) And Three Additional Altcoins,"doge,shib",,X,
1476,2068.0,"Bitcoin (BTC) Still Bullish Despite Correction Below $40,000, According to Top Crypto Analyst – Here’s Why",btc,,X,
1477,2069.0,"$34,000,000,000 Asset Manager Investcorp Launches Global Blockchain Fund","mana,xcn",X,,
1478,2071.0,"Cardano’s (ADA) Biggest Whales Flip Back to Accumulation Mode, Hold Record Percentage of ADA: Santiment",ada,,X,
1479,2073.0,Gate.io Is Making a Big Splash During Paris NFT Day Event,gt,,X,
1480,2075.0,"Terra (LUNA) Now Owns Over $1,570,000,000 in Bitcoin (BTC) After Most Recent Purchase: BitInfoCharts",btc,,X,
1481,2078.0,"Crypto Strategist Predicts Big Run for One Ethereum Competitor, Updates Forecasts for ETH and Skale (SKL)",eth,,X,
1482,2079.0,Crypto Analyst Who Accurately Called 2018 Bitcoin Bottom Predicts Massive Correction for Ethereum Competitor Terra (LUNA),"btc,eth",,X,
1483,2080.0,"Analyst Predicts Shiba Inu (SHIB) Moves Hard This Cycle, Says One Ethereum (ETH) Rival Will Be Top Performer","eth,shib",,X,
1484,2081.0,"Crypto Insider Issues Stark Warning for Bitcoin, Ethereum, Altcoins and Stocks, Says Wide-Scale Carnage Incoming","btc,eth",,X,
1485,2083.0,"One Sector of Altcoin Market Will Get Quashed Once Regulation Arrives, According to Top Crypto Analyst",ltc,,X,
1486,2084.0,"Institutions Take Profit After Market Rally, but Solana (SOL) and Cardano (ADA) Remain Resilient: CoinShares","ada,sol",,X,
1487,2085.0,Former Goldman Sachs Executive Raoul Pal Unveils Massive End-of-Decade Prediction for Crypto Markets,xec,,X,
1488,2086.0,"Bitcoin Whale Transactions at Lowest Proportions in Nearly 10 Years, According to Analytics Firm Santiment",btc,,X,
1489,2087.0,Here’s What Would Convince Majority of Financial Advisors To Give Green Light on Crypto Investments: Report,ht,,X,
1490,2088.0,Payments-Focused Altcoin Soars 59% in Just One Day As Bitcoin and Ethereum Search for Support,"btc,eth",,X,
1491,2090.0,DeFiChain’s Hotly Anticipated ‘Fort Canning Road’ Hard Fork Goes Live,"dfi,xcn",X,,
1492,2091.0,TiTi Protocol Secures $3.5 Million To Build the First Use-To-Earn Algorithm Stablecoin,algo,X,,
1493,2092.0,Shark Tank Star Kevin O’Leary Reveals 10-Year Gameplan for Investing in Bitcoin Ecosystem: Report,btc,,X,
1494,2093.0,"SEC Official Had Conflict of Interest in Ripple and XRP Lawsuit, According to Anti-Corruption Watchdog",xrp,,X,
1495,2094.0,"$4,000,000,000 in Bitcoin Exiting Crypto Exchanges Every Month As Outflows Reach Historic Proportions: Glassnode",btc,,X,
1496,2095.0,"Crypto Strategist Warns Deep Bitcoin Correction Coming, Says BTC Flashing November 2021 Vibes",btc,,X,
1497,2096.0,Whale Games? Top Crypto Strategist Says This Is Driving Current Bitcoin (BTC) Correction,btc,,X,
1498,2097.0,"Historically Accurate On-Chain Indicator Shows Bitcoin (BTC) Has Asymmetric Upside, Says Crypto Analyst",btc,,X,
1499,2098.0,Tesla Ventures Into 100% Solar-Powered Bitcoin (BTC) Mining With Jack Dorsey’s Block: Report,btc,X,,
1500,2099.0,European Union Slams Russian Crypto Investors With New Rules in Latest Legislation,uni,X,,
1501,2100.0,"Next Bitcoin (BTC) Rally Will Likely Be a Trap, According to Crypto Strategist – Here’s Why",btc,,,X
1502,2101.0,"New Polkadot-Based Altcoin Has Promising Future, According to Coin Bureau","dot,ltc,omi",,X,
1503,2102.0,"Ethereum Scaling Solution and Two Additional Altcoins May Be Gearing Up for Liftoff, According to Top Crypto Analyst",eth,,X,
1504,2103.0,"US Banking Giant Issues Dire Economic Warning, Says Shock Wave Could Send Crypto and Commodities Soaring: Report",omi,,X,
1505,2104.0,"Popular Analyst Updates Bitcoin (BTC), Ethereum (ETH) and Dogecoin (DOGE) Forecasts As Crypto Markets Pull Back","btc,doge,eth",,X,
1506,2105.0,"Bitcoin (BTC) and Ethereum (ETH) Will Explode 100% by Mid-2023, Says Galaxy Digital Trading Co-Head Jason Urban","btc,eth",X,,
1507,2106.0,Shark Tank Star Kevin O’Leary Says Bitcoin (BTC) Mining Will ‘Save the World’ – Here’s How,btc,,X,
1508,2107.0,Credit Card Giant Mastercard Files Multiple Trademark Requests for Crypto-Related Services,fil,X,,
1509,2108.0,Crypto Analytics Firm Santiment Says Ethereum (ETH) Close to ‘Opportunity Zone’ – But There’s a Catch,eth,,X,
1510,2109.0,"This Top-10 Altcoin’s Future Is Now ‘Even Brighter’ Amid Explosive Growth, Says Terra (LUNA) Co-Founder Do Kwon","ht,ltc",,X,
1511,2110.0,"Ethereum Whales Are Diving Into One Metaverse Altcoin and Unloading Bitcoin, According to On-Chain Analysis","btc,eth",,X,
1512,2111.0,"Top Crypto Analyst Warns ‘Vaporware’ Ethereum Rivals Will Go To Zero, Says Traders Underestimating ETH’s Price Trajectory",eth,,X,
1513,2112.0,"Here’s What Next for Polygon (MATIC), VeChain (VET) and Two Other Altcoins: Crypto Analyst Michaël van de Poppe","matic,vet",,X,
1514,2113.0,Payments Giant Cash App Unveils New Feature That Allows Users To Get Paid in Bitcoin (BTC),btc,X,,
1515,2114.0,Former SoftBank CEO Devotes 10% of His Portfolio to Bitcoin (BTC),btc,X,,
1516,2115.0,Jack Mallers Announces Strike Partnering With POS Giants To Allow Bitcoin (BTC) Payments at Major Retailers,btc,X,,
1517,2118.0,"One Ethereum Rival Is Exploding As Institutional Investors Pile In – And It’s Not Solana, Avalanche or Cardano","ada,avax,eth,sol",,X,
1518,2120.0,"Robinhood Announces Integration With Bitcoin (BTC) Lightning Network Amid Rollout of 2,000,000 Crypto Wallets",btc,X,,
1519,2121.0,Shark Tank’s Kevin O’Leary Says Four Altcoins Have Potential – But ‘Granddaddy Crypto’ Bitcoin Is Unbeatable,btc,,X,
1520,2122.0,"Terra (LUNA) Acquiring $100,000,000 of Top Ethereum Competitor After Selecting Bitcoin As Primary Reserve Asset","btc,eth",,X,
1521,2123.0,"Ethereum-Powered DeFi Altcoin Explodes 47% in One Week, Outshining Bitcoin and Crypto Markets",btc,,X,
1522,2124.0,"Is That You, Satoshi? Over $4,300,000 in Bitcoin (BTC) Suddenly Moves After Lying Dormant Since 2009",btc,,X,
1523,2125.0,Cross-Chain Bridges in DeFi – Why Are They So Important?,"cro,xcn",,X,
1524,2126.0,Cardano (ADA) Prospects Are Bright Based on This Metric – But There’s a Catch: Crypto Exchange Kraken,ada,,X,
1525,2128.0,Veteran Trader: April Will Be Crucial for Bitcoin as One Indicator Reaches Inflection Point,btc,,X,
1526,2129.0,Leading Digital Marketplace OpenSea Officially Adds Support for Solana (SOL)-Based NFTs,sol,X,,
1527,2132.0,Coinbase Triggers Altcoin Rally As ‘World’s Lightest Blockchain’ Hits Top Crypto Exchange,"ht,ltc,xcn",,X,
1528,2134.0,Iconic Snowboard Brand Kemper Announces NFTs Collection via SIMBA Chain,xcn,X,,
1529,2135.0,"DeFiChain Adds New dTokens Corresponding to Disney, Intel, MicroStrategy and iShares MSCI China ETF",dfi,,X,
1530,2136.0,Ripple Investment Arm Reveals New Concepts for NFT-Focused Use Cases on XRP Ledger,xrp,,X,
1531,2139.0,MOBLAND and Wormhole Introduce GameFi 2.0 Multi-Chain Metaverse Ecosystem,xcn,,X,
1532,2140.0,"MakerDAO Users Can Now Rely on Stop Loss, Take Profit and Savings Liquidation Protection Strategies Using DeFi Saver",mkr,,X,
1533,2141.0,Crypto Analyst Who Nailed 2018 Bitcoin (BTC) Bottom Bullish on Dogecoin (DOGE) and One Additional Altcoin,"btc,doge",,X,
1534,2142.0,"Analytics Firm Issues Crypto Warning, Says One Bitcoin (BTC) and Ethereum (ETH) Metric Flashing Signs of Correction","btc,eth",,X,
1535,2143.0,"One Ethereum Challenger Is Becoming an Unstoppable Beast, According to Popular Crypto Analyst",eth,,X,
1536,2144.0,"$5,500,000,000 Bitcoin Whale Dives Back Into Crypto Market, Amassing 3,241 BTC in One Day",btc,X,,
1537,2146.0,"‘Decision Time’ for Cardano (ADA) Quickly Approaching, According to Crypto Analyst Benjamin Cowen",ada,,X,
1538,2147.0,Here’s Why Shark Tank Billionaire Mark Cuban Is Bullish On Ethereum Over Coming Months: Report,eth,,X,
1539,2148.0,"Ethereum Significantly Undervalued While Terra, Solana and Additional ETH Rival Show Positive Signals: Bloomberg Analyst","eth,sol",,X,
1540,2149.0,"Here’s Why the Coming Mid-Halving Point for Bitcoin Could Be Different, According to Analytics Firm Santiment",btc,,X,
1541,2152.0,Altcoin Built on Ethereum Blasts Into Stratosphere With 425% Rally As Two Crypto Exchanges Boost Adoption,eth,,X,
1542,2153.0,Bridge Network Raises $3.8 Million To Build Better Cross-Chain Experiences With Backing From FTX Ventures,ftt,,X,
1543,2154.0,LongHash Ventures Partners With Terraform Labs To Accelerate Web 3.0 Development on Terra Blockchain,"cel,xcn",,X,
1544,2155.0,DAO Maker New NFT Launchpad To Host the First-Ever Licensed Maradona Collection,mkr,,X,
1545,2157.0,Swiss DeFi-First Bank Alternative Fluid Finance SA Joins Forces With Predictive Blockchain Analytics Partner Merkle Science,xcn,,X,
1546,2158.0,Bitcoin (BTC) Gearing Up for New Rally As Ethereum (ETH) Takes a Breather: Analyst Michaël van de Poppe,"btc,eth",X,,
1547,2159.0,"FTX.US Chief Brett Harrison Makes Five-Year Predictions for Ethereum (ETH), Solana (SOL) and Avalanche (AVAX)","avax,eth,sol",,X,
1548,2160.0,"Large-Cap Altcoin Replacing Bitcoin (BTC) As Driver of Crypto Market Trend, According to Glassnode Co-Founder",btc,,X,
1549,2161.0,"Crypto Analyst Warns Deep Corrections in Sight for Waves (WAVES), Apecoin (APE) and One More Altcoin","ape,waves",,X,
1550,2162.0,Why CBDC Is the Key To Achieve Economic Stability,omi,,X,
1551,2163.0,"ARK Invest’s Cathie Wood Says Bitcoin Part of Wave of Disruptive Innovation, Compares BTC to Tesla, Amazon",btc,,X,
1552,2164.0,"JPMorgan CEO Jamie Dimon Says Blockchain and Decentralized Finance Are ‘Real,’ With Many Use Cases",xcn,X,,
1553,2165.0,"Underrated Indicator Could Send Bitcoin on ‘Disbelief’ Rally, According to Closely Followed Crypto Analyst",btc,,X,
1554,2167.0,"SEC Chair Gary Gensler Says Crypto Industry Hype Reminds Him of Dot-Com Bubble, Urges Regulation",dot,,,X
1555,2168.0,"Crypto Traders Are Sleeping on Dogecoin Competitor Shiba Inu, According to Analyst – Here’s His Strategy","doge,shib",,X,
1556,2169.0,"DAODAO Announces Plans To Support Dogecoin, Attempts Twitter Takeover",doge,,X,
1557,2170.0,Hardware Crypto Wallet Trezor Warns Users of Phishing Attack After Company Email System Is Compromised,omi,,,X
1558,2171.0,Accredited Web Comic Creators Maya and Yehuda Devir Launch Their XOXO NFT Collection,omi,,X,
1559,2172.0,"Financial Markets Not Yet Ready for Bitcoin-Backed Bonds, Says MicroStrategy’s Michael Saylor","bit,btc,cro",,X,
1560,2173.0,"Altcoin Ecosystem Built on Ethereum (ETH) Primed for Serious Gains, According to Closely Followed Crypto Analyst",eth,,X,
1561,2174.0,"Here’s What’s Ahead for Chainlink, NEAR and Three Other Altcoins, According to Analyst Michaël van de Poppe","link,near",,X,
1562,2175.0,Huge Rallies in Sight for Zilliqa (ZIL) and Top Ethereum Gaming Project As Bitcoin (BTC) Breaks Out: Crypto Analyst,"btc,eth,zil",,X,
1563,2176.0,"Rich Dad Poor Dad Author Warns Major Market Crash Coming, Says Bitcoin, Ethereum, Solana and Gold Are Potential Way Out","btc,eth,sol",,X,
1564,2178.0,"Bitcoin (BTC) and Crypto Setting Up for a Perfect Storm, According to Macro Guru Raoul Pal – Here’s Why",btc,X,,
1565,2179.0,"Bitcoin About To Break All-Time Highs Quicker Than Traders Think, Says Analyst Nicholas Merten – Here’s Why",btc,,X,
1566,2180.0,"Institutions Pour Capital Into Ethereum, Solana, and Additional ETH Competitor As Sentiment Recovers: CoinShares","eth,sol",,X,
1567,2181.0,"Crypto Investors Are Rotating Capital Into Riskier Altcoins, According to Glassnode Co-Founder",ltc,,X,
1568,2185.0,Four Altcoins Built on Polkadot (DOT) Explode Amid Rapid Ecosystem Developments,dot,,X,
1569,2186.0,Chainlink (LINK) Threatening To Break Out? Crypto Analyst Benjamin Cowen Checks In on LINK As Markets Pause,link,,X,
1570,2187.0,Majority of Bitcoin Holdings Untouched for Minimum of One Year As Macro Tailwinds Brew: Analyst Will Clemente,btc,,X,
1571,2188.0,"Here’s What Will Ignite a Bitcoin (BTC) Eruption to $58,000, According to Top Crypto Strategist",btc,,X,
1572,2189.0,"$551,370,000,000 in Bitcoin Now Belongs to Long-Term Holders After Massive BTC Accumulation Spree: IntoTheBlock",btc,X,,
