,Article ID,Article Title,Coin Mentioned,Positive,Neutral,Negative
2212,2994.0,"Bitcoin On-Chain Environment Suggesting Bullish Undertones, According to Analytics Firm Glassnode",btc,X,,
2213,2995.0,On-Chain Analyst Willy Woo Makes Argument for Why Bitcoin (BTC) Is Not in a Bear Market,btc,,X,
2214,2996.0,"Institutional Investors Cautiously Building Crypto Positions As BTC Remains Below $40,000",btc,x,,
2215,2997.0,"Bitcoin and Ethereum Prices Should Rise Over Time As BTC and ETH in Early Adoption Days, Says Bloomberg Analyst","btc,eth",x,,
2216,2998.0,"Long-Time Bitcoin Trader Tone Vays Issues Warning, Says BTC Hinting Historically ‘Catastrophic’ Pattern",btc,,,x
2217,2999.0,"Coinbase Lists Two Low-Cap Altcoins Built on Solana (SOL), Triggering Rallies",sol,,x,
2218,3000.0,Astra Protocol Sets Up a Compliance Hub in The Sandbox Virtual World To Bring Fully Decentralized Compliance to Metaverse Users,sand,,x,
2219,3001.0,"New Report Reveals Ripple Ramping Up XRP Sales by 45% in Q4 of 2021, Demand for RippleNet Skyrocketing",xrp,,x,
2220,3002.0,Flint Launches High Annual Crypto Returns on Solana Without the Volatility,sol,x,,
2221,3003.0,"BitMEX Releases BMEX Token Litepaper, Airdrops Over 1.5 Million BMEX to New and Existing Users","ape,bit",,x,
2222,3004.0,Surging Crypto Adoption Will Ultimately Require National and Global Regulations: UNICEF Report,uni,,,x
2223,3005.0,Analyst Michaël van de Poppe Predicts What’s Next for Ethereum Rival Avalanche (AVAX) and Four Other Altcoins,"avax,eth",,x,
2224,3006.0,"XRP, Uniswap (UNI), the Graph (GRT) and Three More Altcoins Approaching ‘Opportunity Zones’: Santiment","grt,uni,xrp",,x,
2225,3007.0,"Here’s When Bitcoin (BTC) Can Realistically Record a New All-Time High, According Crypto Analyst Jason Pizzino",btc,,x,
2226,3008.0,Top Crypto Analyst Unveils ‘Mega Moon’ Scenario for Bitcoin (BTC) This Year – But There’s a Catch,btc,,x,
2227,3009.0,"Top Analyst Issues Warning to Cardano (ADA) Traders, Says Clear Bearish Pattern Forming",ada,,x,
2228,3010.0,Money Laundering Accounts for Less Than 1% of All Crypto Transactions Last Year: Chainalysis Report,xcn,x,,
2229,3011.0,"YouTuber Hacks Crypto Hardware Wallet and Recovers $2,000,000 in Lost THETA",theta,,,x
2230,3014.0,Fears of Rising Interest Rates Hurting Bitcoin Overblown: Crypto Analyst Nicholas Merten,btc,,x,
2231,3015.0,Gate.io First To List Alephium (ALPH),gt,,x,
2232,3016.0,Ethereum-Based Metaverse Token Is Up 130% Over Past Week As Crypto Markets Trade Sideways,eth,,x,
2233,3017.0,Large Cardano (ADA) Holders More Than Double Their Holdings in Just 10 Days: Crypto Insights Firm Santiment,ada,x,,
2234,3020.0,"Macro Guru Raoul Pal Says Investors Bullish on Terra (LUNA) and Polkadot (DOT), Predicts Strong Rally for Ethereum","dot,eth",,x,
2235,3021.0,"Bitcoin in Demand Lately, Says On-Chain Analyst Willy Woo – Here’s Who’s Buying BTC Above $30,000",btc,,x,
2236,3022.0,"One Gaming Altcoin Has Bright Future Ahead of It, According to Coin Bureau – Here’s Why","ht,ltc",,x,
2237,3023.0,"Ethereum Whale Splurges $637,000,000 on One Crypto Exchange Token, Making It Top Traded Coin Among ETH Investors",eth,x,,
2238,3024.0,Top Analyst Predicts ‘Ultimate Capitulation’ for Bitcoin (BTC) and Ethereum (ETH) Before Bullish Reversal,"btc,eth",,x,
2239,3025.0,"Crypto Analyst Says Markets Flashing First Sign of Health, Predicts Rallies in Ethereum (ETH) and Competitor Terra (LUNA)",eth,,x,
2240,3026.0,"JPMorgan Analysts Drastically Lower Long-Term Price Target for Bitcoin, Name Biggest Challenges for BTC: Report",btc,,x,
2241,3027.0,"Mainstream Adoption Might Not Boost Bitcoin’s Price, According to Banking Giant Goldman Sachs: Report","bit,btc,ht",,x,
2242,3028.0,"Here’s How Long It Will Take for Bitcoin To Reach $500,000, According to SkyBridge Capital Founder Anthony Scaramucci",btc,,x,
2243,3029.0,"Here’s What Needs To Happen for Bitcoin (BTC) To Catch Fire and Rally Toward $50,000, According to Analyst Justin Bennett",btc,,x,
2244,3030.0,Will Ethereum (ETH) Really Flip Bitcoin (BTC)? Coin Bureau Looks at Possibility of ‘Flippening’ in Coming Months,"btc,eth",,x,
2245,3031.0,Are Bitcoin Whales Buying the Dip? On-Chain Analyst Will Clemente Says New Trend Emerging for Large BTC Investors,btc,,x,
2246,3032.0,Is Spell Token Out of Danger? Analytics Firm Santiment Says SPELL at Risk if Bitcoin Does This,btc,,x,
2247,3033.0,State Senator Introduces Bill To Make Bitcoin (BTC) Legal Tender in Arizona,btc,x,,
2248,3036.0,"Coinbase Will List New Class of Crypto Assets, Move Beyond Ethereum Tokens: Report",eth,,x,
2249,3037.0,Massive Crypto Whale Quietly Accumulating One Ethereum Competitor and Top Gaming Altcoin,eth,,x,
2250,3038.0,"Celsius Network CEO Predicts New All-Time High for Ethereum, Warns Bitcoin Could Crash Before Massive Rally","btc,cel,eth",,x,
2251,3039.0,Low-Cap DeFi Altcoin Surges After Crypto.com Retail Listing,ltc,,x,
2252,3040.0,Metaverse Crypto the Sandbox (SAND) Announces Partnership With World-Renowned Music Label,sand,,x,
2253,3043.0,El Salvador’s President Responds to IMF After the Institution Advises Country To Drop Bitcoin As Legal Tender,btc,,,x
2254,3044.0,Ethereum Adoption Is in Overdrive Despite Crypto Market Downturn: Altcoin Daily,eth,,x,
2255,3047.0,Solana Based DeFi Land Announces Revenue-Generating Gen-Zero NFT Seed Sale,sol,,x,
2256,3048.0,"DeFi Wallet Ambire Gains Momentum, Launches WALLET Token on Huobi Primelist",ht,,x,
2257,3049.0,"This Class of Investors Is Still Sinking Massive Amounts of Cash Into Crypto, According to FTX US Chief Brett Harrison",ftt,,x,
2258,3050.0,"Bitcoin Is Trading at a Loss and Ethereum Is Oversold, According to Kraken – Here’s What Could Happen Next","btc,eth",,x,
2259,3054.0,"Macro Analyst Lyn Alden Says Bitcoin Unlikely To Go Below $20,000, but Warns BTC Could Crash if This Happens",btc,,x,
2260,3055.0,"Gaming Altcoin the Sandbox (SAND) Announces $50,000,000 Accelerator Fund for Metaverse Start-Ups",sand,x,,
2261,3056.0,Macro Guru Raoul Pal Says Shift in Narrative Triggering Volatility in Crypto Markets – Here’s What He Predicts Comes Next,cro,,x,
2262,3057.0,"Here’s What Bitcoin (BTC) Must Reclaim To Become Bullish, According to Crypto Analyst Michaël van de Poppe",btc,,x,
2263,3058.0,"New York Commercial Bank With Over $8,000,000,000 in Total Assets To Offer Bitcoin Services",btc,x,,
2264,3059.0,Billionaire Elon Musk Sends Dogecoin (DOGE) Surging As Whales Gobble Up Dog-Themed Crypto Assets,doge,x,,
2265,3060.0,"Several Factors Will Send One Ethereum Competitor to the Moon Over the Coming Months, According to Altcoin Daily",eth,,x,
2266,3061.0,"Quantum Computers Will Make Bitcoin Vulnerable in the Future, Researchers Say: Report",btc,,x,
2267,3062.0,BitMEX Academy Launches With Vision To Raise the Bar for Crypto Education,bit,,x,
2268,3063.0,"Ethereum (ETH) Is Showing Signs of Bottoming Out, According to CNBC’s Jim Cramer – But There’s a Catch",eth,,,x
2269,3064.0,"Closely Followed Trader Says Bitcoin (BTC) Relief Rally Likely, Highlights What’s Next for Curve (CRV)","btc,crv",,x,
2270,3065.0,Cardano (ADA) vs. Ethereum (ETH) – Here’s What Crypto Exchange Kraken Says,"ada,eth",,x,
2271,3066.0,"Here’s What Will Matter More Than Ever for Bitcoin in 2022, According to Fidelity Macro Strategist",btc,,x,
2272,3067.0,"Bounce Incoming for Bitcoin (BTC), According to Crypto Analyst Michaël van de Poppe – Here’s His Target",btc,x,,
2273,3068.0,Crypto Exchange FTX Reaches Massive $8 Billion Valuation in New Funding Raise,ftt,x,,
2274,3069.0,Short-Term Bitcoin Holders Taking the Brunt of BTC Capitulation: Analytics Firm Glassnode,btc,,,x
2275,3070.0,"This Ethereum Competitor Is Likely To Break Into the Top 5 Crypto Assets by Market Cap, According to Coin Bureau",eth,,x,
2276,3071.0,"Large Investors Will Create a Bottom for Bitcoin (BTC), According to Host of InvestAnswers",btc,x,,
2277,3072.0,Cathie Wood’s Ark Invest Makes Massive 2030 Prediction for Bitcoin (BTC) and Ethereum (ETH) – Here’s Their Target,"btc,eth",,x,
2278,3074.0,Crypto Community HeritageDAO Seeks To Acquire Korean National Treasures,uni,,x,
2279,3075.0,"Solana (SOL) and Avalanche (AVAX) at a Discount, but Looming Fed Meeting Could Threaten Bull Run: Analyst Nicholas Merten","avax,sol",,x,
2280,3076.0,"Former Goldman Sachs CEO Reverses Stance on Bitcoin (BTC) and Crypto, Says Digital Assets Are Maturing",btc,,x,
2281,3079.0,SEC Awarded More Time To Fight Order To Hand Over Sensitive Documents in XRP Lawsuit,xrp,,x,
2282,3080.0,"Largest Ethereum Whales Pounce on Shiba Inu, Buy Over $88,000,000 Worth of SHIB in the Past Day","eth,shib",,x,
2283,3081.0,Can Ethereum Compete With Its Rivals This Year? Coinbase Looks at State of ETH in New Report,eth,,x,
2284,3082.0,"Trading Veteran Tone Vays Says Bitcoin Bull Market Is Not Over, Doubles Down on $100,000 BTC Call",btc,x,,
2285,3085.0,Popular Trader Predicts One More Bitcoin Dip Before Epic Rally – Here’s His Bottom Target for BTC,btc,,x,
2286,3086.0,"Binance Lists Altcoin Built on Polkadot (DOT), Plus An Additional Crypto Asset On Terra (LUNA)",dot,,x,
2287,3087.0,End of Bitcoin Downtrend? Crypto Analyst Benjamin Cowen Looks at Worst-Case Scenario for BTC,btc,,x,
2288,3088.0,Bitcoin Is an Early Adoption Technology Set for Volatile Growth Like Amazon Stock: SkyBridge Capital’s Anthony Scaramucci,btc,x,,
2289,3089.0,"Investment Banking Giant Issues Bitcoin (BTC) and Crypto Warning, Says Correction Could Start Multi-Year Bear Winter: Report",btc,,,x
2290,3090.0,"Cosmos (ATOM), Fantom (FTM) and 23 Other Altcoins Added to Crypto Giant Grayscale’s List of Assets Under Consideration","atom,ftm",,x,
2291,3091.0,Coinbase Suddenly Lists Five New Altcoin Projects Triggering Parabolic Rallies,ltc,x,,
2292,3092.0,Blockchain Tools That Can Help Traders Increase Profitability,xcn,,x,
2293,3093.0,"Top Crypto Analyst Maps Out Bitcoin Reversal, Predicts Rallies for Altcoins in the Coming Weeks",btc,,x,
2294,3096.0,"Ocean of Capital Could Flow Into Ethereum (ETH) This Year, According to Coin Bureau – Here’s Why","eth,flow",,x,
2295,3097.0,"Here’s What’s Ahead for Ethereum Rivals Cardano (ADA), Fantom (FTM) and Harmony (ONE), According to Analyst Michaël van de Poppe","ada,eth,ftm",,x,
2296,3098.0,Here’s How Long It Typically Takes Bitcoin To Recover After Major Crash: InvestAnswers,btc,,x,
2297,3100.0,"Here’s What’s Next for Cardano (ADA), Polkadot (DOT), Terra (LUNA) and Four Additional Altcoins, According to Top Crypto Trader","ada,dot",,x,
2298,3102.0,"One Bullish Crypto Sector Has a Bright Future Ahead of It, According to Coin Bureau – Here’s Why",ht,,x,
2299,3103.0,"As Markets Break Down, Traders Favor Ethereum (ETH), Solana (SOL), and Two More Altcoins, According to Crypto Algorithm","eth,sol",,x,
2300,3104.0,$9.5 Trillion Asset Manager BlackRock Makes Big Move Into Crypto With Blockchain ETF Investment,"mana,xcn",x,,
2301,3105.0,"Institutions Buying the Dip? Cardano (ADA), Solana (SOL) and Polkadot (DOT) See Minor Inflows As Markets Correct: CoinShares","ada,dot,sol",x,,
2302,3106.0,MetaVisa Will Start the IEO Sale of MESA Token on BitMart,bit,,x,
2303,3108.0,TeraBlock Announces Collaboration With Splinterlands To Take DeFi Gaming to New Heights,ht,,x,
2304,3109.0,"Analyst Nicholas Merten Makes Massive Late 2022 Bitcoin Prediction, Says Latest BTC Crash Setting Bull Run Foundation",btc,,x,
2305,3111.0,Global NFT Sales Explode in Last 30 Days Despite Correction Across Crypto Markets,cro,,x,
2306,3112.0,Threat of Nested Exchanges and What Binance Is Doing To Combat Them,bat,,x,
2307,3113.0,"3space Art Kicks Off ‘Enter the Void,’ the First NFT Art Exhibition Held Simultaneously in a Physical Gallery and the Metaverse","bit,neo",,x,
2308,3114.0,"Macro Guru Raoul Pal Says Crypto Going Through Massive Stress Test, Warns of More Downside Risk for Bitcoin (BTC)",btc,,,x
2309,3115.0,"Bitcoin (BTC) Flashing ‘Perfect’ Setup for a Bounce, According to Trading Veteran Tone Vays",btc,,x,
2310,3116.0,"Shiba Inu (SHIB), Terra (LUNA) and Pancakeswap (CAKE) Showing Signs of Recovery After Altcoins Correct: Santiment","cake,shib",,x,
2311,3117.0,"Are Bitcoin Whales Buying? Morgan Creek’s Anthony Pompliano Looks at Behavior of Large Investors As BTC Trades Close to $30,000",btc,,x,
2312,3118.0,"Most Cardano (ADA), Shiba Inu (SHIB) and Polygon (MATIC) Holders Now Underwater Amid Deep Pullback: IntotheBlock","ada,matic,shib",,x,
2313,3119.0,Ethereum Competitors Like Solana (SOL) and NEAR Set for ‘Immense Growth’ This Year: Pantera Capital,"eth,near,sol",,x,
2314,3122.0,"Here’s the Worst-Case Scenario for Bitcoin, According to Trader Who Called the BTC Collapse in May",btc,,x,
2315,3123.0,Ethereum Rival Fantom (FTM) Overtakes Solana (SOL) and Avalanche (AVAX) To Become Fourth-Largest Blockchain by Total Value Locked,"avax,eth,ftm,sol",,x,
2316,3124.0,Any Signs of Reversal in Sight? Analyst Benjamin Cowen Looks at State of Bitcoin After 50% Crash,btc,,x,
2317,3125.0,Crypto Trader Who Nailed Bitcoin Bottom in 2018 Unveils Bullish BTC Price Trajectory for 2022 – But There’s a Catch,btc,,x,
2318,3127.0,"Ethereum Whales Are Jumping Into Several Altcoins As Bitcoin Fights To Break Above $40,000","btc,eth",,x,
2319,3128.0,"After Mind-Blowing Price Spike, Low-Cap Altcoin Loses Steam Amid Coinbase Retail Listing",ltc,,x,
2320,3129.0,"CNBC’s Jim Cramer Warns Investors About Dogecoin (DOGE), Claims the Crypto Asset Is a Security",doge,,x,
2321,3131.0,Executives at Crypto Exchange Binance Allegedly Neglected Compliance Responsibilities: Report,xec,,,x
2322,3132.0,Crypto Venture Capitalist Says He’s Bullish on Several Ethereum Rivals Amid Shift in Crypto Market Dynamics: Report,eth,,x,
2323,3133.0,"Top Crypto Analyst Updates Outlook on Bitcoin, Says This Is When the Correction Could End",btc,,x,
2324,3134.0,"Here’s What’s Behind the Crypto Market Downturn in 2022, According to MicroStrategy CEO Michael Saylor",cro,,x,
2325,3135.0,"Over $1,142,000,000 in Crypto Liquidated in Just 24 Hours As Bitcoin Trades Below $40,000, According to Coinglass",btc,,,x
2326,3136.0,How Ethereum 2.0 Will Help the Crypto Community,eth,,x,
2327,3138.0,"Billionaire Mike Novogratz Issues Fresh Crypto Warning As Bitcoin Hovers Below $40,000",btc,,x,
2328,3139.0,Whales Gobble Up Bitcoin As Non-Exchange BTC Supply Surges to All-Time High: Santiment,btc,x,,
2329,3142.0,Top Crypto Strategist Updates Bitcoin Outlook and What To Expect After Crypto Market Fallout,btc,,x,
2330,3143.0,Chainlink (LINK) Competitor Rallies After Earning Support From Top Crypto Exchange Binance,link,,x,
2331,3144.0,Binance Helps Take Down Cybercriminal Ring Laundering $500 Million in Ransomware Attacks,mina,x,,
2332,3146.0,Former VK.com CEO Andrew Rogozov Joins TON Foundation As Founding Member To Oversee Product Efforts at Successor of Telegram’s Blockchain Project,xcn,,x,
2333,3148.0,Gate Ventures Invests in SEBA Bank’s Series C Funding Round,gt,,x,
2334,3149.0,"There’s a Decent Chance Bitcoin Will Outperform Other Crypto Assets, Says Analyst Benjamin Cowen – Here’s When",btc,,x,
2335,3150.0,"Here’s What Will Catapult Cardano (ADA) to a New All-Time High in 2022, According to deVere Group CEO Nigel Green",ada,,x,
2336,3151.0,"Little-Known Altcoin Project That’s Up Over 70% Year-to-Date Launches $400,000,000 Ecosystem Fund",ltc,x,,
2337,3154.0,Top Crypto Analyst Says This DeFi Altcoin Is Primed for a 10x Rally,ltc,,x,
2338,3155.0,Tech Giant Google Forms Blockchain Unit in Push Towards Crypto Adoption,"uni,xcn",x,,
2339,3156.0,Crypto Analyst Nicholas Merten Predicts Dramatic Volatility for Bitcoin – Here’s His Target,btc,,x,
2340,3157.0,"Cardano Launches First Decentralized Exchange Built on ADA, Triggering Price Spike",ada,,x,
2341,3159.0,Crypto Exchange Titan Binance Lists New Blockchain MMO Strategy Gaming Altcoin,"ltc,xcn",,x,
2342,3160.0,"Crypto Strategist Justin Bennett Updates Outlook on Bitcoin (BTC), Ethereum (ETH), and Two Popular Altcoins","btc,eth",,x,
2343,3164.0,"Bitcoin and Ethereum Will Correct and Come Back Stronger, but Not These Crypto Assets: Bloomberg Commodity Strategist","btc,eth",,x,
2344,3165.0,Crypto Analyst Who Called 2018 Bitcoin Bottom Says a Bullish Reversal Pattern for BTC Is Forming,btc,,x,
2345,3166.0,"Ethereum (ETH), Solana (SOL) and Polygon (MATIC) Will Be Explosive in 2022, According to Altcoin Daily – Here’s Why","eth,matic,sol",,x,
2346,3168.0,Binance Becomes the Blockchain and Cryptocurrency Industry’s First To Join the National Cyber-Forensics and Training Alliance (NCFTA),xcn,x,,
2347,3169.0,Crypto Analyst Justin Bennett Says Polkadot (DOT) Breakout Imminent – Here Are His Targets,dot,,x,
2348,3170.0,300 Small US Banks Set To Offer Bitcoin Trading in Second Quarter of 2022: Report,btc,x,,
2349,3171.0,"Shark Tank Investor Kevin O’Leary Says Solana (SOL), Polygon (MATIC) and Hedera (HBAR) Have ‘Large’ Potential","hbar,matic,sol",,x,
2350,3172.0,"Major Spikes Could be Coming for Binance Coin (BNB), Axie Infinity (AXS), Monero (XMR) and Four More Altcoins: Santiment","axs,bnb,xmr",,x,
2351,3173.0,Cardano (ADA) Metaverse Launches With Thousands Investing in Its Digital Real Estate,ada,,x,
2352,3174.0,Bitcoin (BTC) Running Out of Time To Save Bull Market: Veteran Trader Tone Vays,btc,,,x
2353,3176.0,"Ethereum Oversold and Due for a Bounce, According to InvestAnswers – Here’s Why",eth,,x,
2354,3177.0,Polygon Starts Burning MATIC Tokens After Successfully Implementing Ethereum (ETH) Update,"eth,matic",,x,
2355,3178.0,Next-Generation Privacy Infrastructure Provider Nym Introduces Cosmos-Based Blockchain ‘Nyx’,xcn,,x,
2356,3181.0,"Bitcoin ‘Mega Whales’ Make Reappearance As BTC Struggles To Stay Above $40,000: Crypto Intelligence Firm Santiment",btc,x,,
2357,3182.0,Can Cardano Continue Its Rally? Crypto Analyst Benjamin Cowen Looks at What’s Ahead for ADA,ada,,x,
2358,3183.0,"Here’s What’s Next for Bitcoin (BTC), Ethereum (ETH) and Solana (SOL), According to Crypto Analyst Pentoshi","btc,eth,sol",,x,
2359,3184.0,"Third-Richest Ethereum Whale Splurges Over $128,000,000, Accumulates Two Metaverse Tokens and Four Other Crypto Assets",eth,x,,
2360,3185.0,Ethereum Challenger Harmony (ONE) ‘Heavily Bullish’ As Cardano (ADA) Ignites New Market Cycle: Analyst Michaël van de Poppe,"ada,eth",,x,
2361,3186.0,Cardano (ADA) Launches New Project To Accelerate Decentralized Application Development,ada,,x,
2362,3187.0,"Bitcoin Is Harder To Manipulate Than Gold, Says Analyst PlanB – Here’s Why",btc,x,,
2363,3188.0,Bitcoin-Integrated Altcoin Spikes After Earning Surprise Support From Coinbase,"bit,btc,ltc",,x,
2364,3189.0,Solana (SOL) Remains a Favorite Among Institutions As Negative Crypto Sentiment Shows Signs of Cooling: CoinShares,sol,,x,
2365,3191.0,"‘Hive Mind’ Algorithm Shows Crypto Traders Bullish on Polkadot (DOT), Avalanche (AVAX) and Polygon (MATIC)","avax,dot,matic",,x,
2366,3192.0,"AutoSwap Brings Limit Orders and Stop Losses to Trader Joe and Avalanche, Powered by Autonomy Network",avax,x,,
2367,3193.0,Stablecoin Infrastructure Provider Stably Raises Pre-Series A Round Led by VeChain’s CEO and Morgan Creek Capital,"vet,xcn",,x,
2368,3194.0,"JPMorgan Says Solana (SOL), Tezos and One More ETH Rival Challenging Ethereum’s Dominance in the NFT Market: Report","eth,sol,xtz",,x,
2369,3195.0,Retail Giant Walmart Files Trademarks for Its Own NFT Marketplace and Cryptocurrency,fil,x,,
2370,3196.0,"QANplatform Launches the World’s First Ethereum-Compatible, Quantum-Resistant Blockchain","eth,qnt,xcn",,x,
2371,3199.0,Dogecoin (DOGE) and Shiba Inu (SHIB) Among the Most Popular Cryptocurrencies in the US: New Huobi Global Survey,"doge,ht,shib",,x,
2372,3200.0,Four Under-the-Radar Altcoins Explode 113% or More in Just Seven Days As Bitcoin (BTC) and Ethereum (ETH) Trade Sideways,"btc,eth",,x,
2373,3201.0,"Ethereum (ETH) Has Eight Main Competitors, According to InvestAnswers – Here Are His Picks",eth,,x,
2374,3202.0,"Cardano (ADA), Binance Coin (BNB) and Two More Altcoins Signal Crypto Not in Bear Market: Analyst Nicholas Merten","ada,bnb",,x,
2375,3203.0,JPMorgan Executive Says Crypto Is in the ‘Napster’ Phase of Its Life Cycle: Report,xec,,x,
2376,3204.0,"Crypto Strategist Predicts Breakout for Ethereum Challenger Fantom (FTM), Says Solana (SOL) Primed To Rally","eth,ftm,sol",,x,
2377,3205.0,"Two Crypto Sectors Growing Rapidly, Defying Overall Market Correction: DappRadar",ada,,x,
2378,3207.0,Top Crypto Analyst Says Cardano (ADA) Has Woken Up – Here Are His Targets,ada,,x,
2379,3208.0,Privacy-Preserving Altcoin Project Soars on Launch of ‘Shocking’ New Initiative While Crypto Markets Underwhelm,ltc,,x,
2380,3209.0,Nearly 25% of Small and Micro-Size Businesses Plan To Accept Crypto Payments This Year: New Visa Survey,"cro,near",x,,
2381,3210.0,"DeFi Data Network Unmarshal Doubles Down on Solana, Signs Key Advisor",sol,,x,
2382,3212.0,Gate.io’s NFT Magic Box Successfully Reached These Major Milestones in 2021,gt,,x,
2383,3213.0,Fantom (FTM) Flashing Bullish Signal Amid Epic Rally Close to All-Time High: Crypto Insights Firm Santiment,ftm,,x,
2384,3214.0,"Bitcoin Bull Max Keiser Updates $220,000 BTC Prediction – Here’s His Timeline",btc,,x,
2385,3215.0,"One Ethereum Rival Will Follow Explosive Rallies of Solana (SOL) and Avalanche (AVAX), According to Top Crypto Analyst","avax,eth,sol",,x,
2386,3216.0,"Raoul Pal Unveils 2022 Price Predictions for Bitcoin (BTC) and Ethereum (ETH), Says One Crypto Sector Will Explode This Year","btc,eth",,x,
2387,3217.0,Litecoin (LTC) Whales in Longest Accumulation Streak Since 2017: Crypto Intelligence Firm Santiment,ltc,x,,
2388,3218.0,"30% Rally for Bitcoin Is Likely Just Around the Corner, According to Crypto Analyst Justin Bennett",btc,x,,
2389,3220.0,"Chainlink (LINK) Has Nothing but Bullish Times Ahead, According to InvestAnswers – Here’s Why",link,,x,
2390,3221.0,Investment Giant Fidelity Says Countries That Adopt Bitcoin Early May Outperform Their Peers: Report,btc,x,,
2391,3222.0,"Bitcoin Looking Great, but XRP May Soon Take the Spotlight, Says Top Crypto Analyst","btc,xrp",,x,
2392,3223.0,"Macro Guru Raoul Pal Says Terra (LUNA), Avalanche (AVAX) and Three Additional Altcoins Will Shine in 2022",avax,,x,
2393,3224.0,"This Altcoin Will Be the ‘Google’ of Crypto, According to SkyBridge Capital Founder Anthony Scaramucci",ltc,,x,
2394,3225.0,"These Upcoming Crypto Milestones Could Trigger a Massive Rally for Solana, Dogecoin and Three Altcoins: Coin Bureau","doge,sol",,x,
2395,3227.0,"Major City Investing One-Percent of Its Treasury in Crypto, Mulling Possible Bitcoin Tax Discount",btc,x,,
2396,3228.0,"Crypto Exchange FTX Rolls Out $2,000,000,000 Venture Fund",ftt,x,,
2397,3229.0,"Fidelity Macro Strategist Says Bitcoin Has Drawn a Major Line in the Sand at $40,000 – Here’s What It Means","btc,sand",,x,
2398,3230.0,"One Ethereum Rival Eyes Major Breakout After Gaining $1,200,000,000 in Total Value Locked: Delphi Digital",eth,,x,
2399,3231.0,"Fantom (FTM) and One Ethereum Competitor Are Gunning for All-Time Highs, According to Top Crypto Analyst","eth,ftm",,x,
2400,3232.0,Low-Cap Altcoin Soars 372% in One Week After Earning Surprise Support From Crypto Exchange Coinbase,ltc,,x,
2401,3233.0,"Here’s What Next for Bitcoin, Ethereum and These Two Altcoins, According to Crypto Analyst Justin Bennett","btc,eth",,x,
2402,3234.0,Mark Cuban Is Quietly Accumulating Several Altcoins Built on Ethereum – Here’s a Look at the Billionaire’s Top Crypto Holdings,eth,,x,
2403,3236.0,"Elon Musk Announces Dogecoin (DOGE) Adoption at Tesla, Ignites Memecoin Explosion",doge,x,,
2404,3238.0,"Veteran Trader Tone Vays Updates Outlook on Bitcoin After Top Crypto Breaks Above $42,000",btc,,x,
2405,3239.0,"The Most Undervalued Altcoin in DeFi Could Blow Up 5X This Year, According to Coin Bureau",ltc,,x,
2406,3240.0,US Lawmakers Schedule Hearing To Probe Energy Impact of Crypto,mkr,,,x
2407,3241.0,VotingDAO – The First Decentralized Voting System Opens Up Voting for Blockchain Person of the Year 2021,xcn,,x,
2408,3242.0,Calamari Network Rolls Out Community Governance Measures As Decentralization Efforts Advance,uni,,x,
2409,3243.0,Is Cardano Entering a Bull Market? Crypto Analyst Jason Pizzino Updates Outlook on ADA,ada,,,x
2410,3244.0,"New Ethereum Competitor Soars After Announcing $150,000,000 Fundraising Round",eth,,x,
2411,3245.0,Massive Ethereum Whale Begins Accumulating Four Altcoins As Bitcoin and Crypto Markets Recover,"btc,eth",,x,
2412,3246.0,"These Crypto Assets Have 10X Potential in 2022, According to Altcoin Daily","dai,ltc",,x,
2413,3247.0,Can Blockchain’s Capacity for Community Unlock Success for Early-Stage Startups?,"uni,xcn",,x,
2414,3248.0,"Did Bitcoin Flash Its Reversal Signal? Top Trader Looks at BTC’s Dip Below $40,000",btc,,x,
2415,3249.0,Crypto.com Lists New Ethereum-Based Decentralized Exchange Token,eth,,x,
2416,3250.0,Twitter CEO Jack Dorsey Launches New Legal Defense Fund To Protect Bitcoin Developers From Lawsuits,btc,x,,
2417,3252.0,Fed Chair Jerome Powell Says Full Report on Digital Currencies To Be Released in Coming Weeks,omi,,x,
2418,3253.0,"Top Ethereum Rival Could Become the ‘Visa’ of Crypto Assets, According to Bank of America Analyst",eth,,x,
2419,3254.0,"Crypto Giant Coinbase Abruptly Adds Four Ethereum Tokens, Sparking 296% Altcoin Rally",eth,,x,
2420,3255.0,Announcing the Encode x Tezos Partnership and Initiatives,xtz,,x,
2421,3256.0,Solrise Hires TradFi Exec To Bring Solana DeFi to Institutional Players,sol,,x,
2422,3258.0,"Here’s Why a Spot Bitcoin ETF is Coming This Year, According to Bitwise CIO Matt Hougan",btc,,x,
2423,3259.0,"Bitcoin (BTC) Could More Than Double in Coming Months, According to Nexo Co-Founder – Here’s Why","btc,nexo",x,,
